{
  "manifest_id": "p2a_assessment_engineering_freeze_manifest_v1",
  "manifest_version": "p2a_assessment_engineering_freeze_manifest_v1",
  "schema_version": "p2a_assessment_engineering_freeze_manifest_v1",
  "status": "engineering_freeze",
  "scientifically_validated": false,
  "psychometrically_calibrated": false,
  "expert_approved": false,
  "production_ready": false,
  "created_for_phase": "P2B-0",
  "notes": {
    "engineering_frozen_definition": "No unreviewed structural/content changes may be introduced while Core Method v2 is implemented.",
    "does_not_mean": [
      "scientifically validated",
      "psychometrically calibrated",
      "expert approved",
      "production ready"
    ],
    "pair_registry_metadata_note": "EQ and Frequency parents/candidates include reverse-pair consistency_mode metadata; SHA values reflect those intentional metadata updates. Question/option text and trait deltas were not changed by reverse-RVI alignment."
  },
  "artifacts": [
    {
      "path": "assets/data/assessment_v3/iq/iq_pilot_tr_v1.json",
      "module": "iq",
      "role": "iq_pilot_parent",
      "form_id": "iq_tr_pilot_v1",
      "content_version": "iq-tr-pilot-v1",
      "parent_content_version": null,
      "schema_version": 3,
      "review_state": null,
      "calibration_status": "uncalibrated",
      "status": "pilot",
      "sha256": "f4ad875ae61a855fa1c4fd5f533306b560d1cccb4c8294c911190700032ec896",
      "runtime_loaded": false,
      "production_wired": false,
      "question_text_freeze_status": "frozen",
      "option_text_freeze_status": "frozen",
      "evidence_delta_freeze_status": "frozen",
      "metadata_freeze_status": "frozen",
      "known_pending_reviews": [
        "expert_psychological_review",
        "expert_language_review",
        "cognitive_interviews",
        "psychometric_calibration"
      ],
      "engineering_freeze_meaning": "No unreviewed structural/content changes while Core Method v2 is implemented. Not scientifically validated, not production ready."
    },
    {
      "path": "assets/data/assessment_v3/iq/iq_pilot_tr_v1_review_candidate_1.json",
      "module": "iq",
      "role": "iq_review_candidate",
      "form_id": "iq_tr_pilot_v1_review_candidate_1",
      "content_version": "iq-tr-pilot-v1-review-candidate-1",
      "parent_content_version": "iq-tr-pilot-v1",
      "schema_version": 3,
      "review_state": null,
      "calibration_status": "uncalibrated",
      "status": "internal_review",
      "sha256": "93b58aa74ac3079b931914204f621ab42ac7a350a7d54f5ebe254a72500580b2",
      "runtime_loaded": false,
      "production_wired": false,
      "question_text_freeze_status": "frozen",
      "option_text_freeze_status": "frozen",
      "evidence_delta_freeze_status": "frozen",
      "metadata_freeze_status": "frozen",
      "known_pending_reviews": [
        "expert_psychological_review",
        "expert_language_review",
        "cognitive_interviews",
        "psychometric_calibration"
      ],
      "engineering_freeze_meaning": "No unreviewed structural/content changes while Core Method v2 is implemented. Not scientifically validated, not production ready."
    },
    {
      "path": "assets/data/assessment_v3/eq/eq_pilot_tr_v1.json",
      "module": "eq",
      "role": "eq_pilot_parent",
      "form_id": "eq_tr_pilot_v1",
      "content_version": "eq-tr-pilot-v1",
      "parent_content_version": null,
      "schema_version": 3,
      "review_state": "internal_review",
      "calibration_status": "uncalibrated",
      "status": "pilot",
      "sha256": "5e54e7c5290f2277da2c9ffbdc88665f7dcb609be48143c6e6dd498cf8899bc1",
      "runtime_loaded": false,
      "production_wired": false,
      "question_text_freeze_status": "frozen",
      "option_text_freeze_status": "frozen",
      "evidence_delta_freeze_status": "frozen",
      "metadata_freeze_status": "frozen_with_acknowledged_pair_registry_mode_metadata",
      "known_pending_reviews": [
        "expert_psychological_review",
        "expert_language_review",
        "cognitive_interviews",
        "psychometric_calibration"
      ],
      "engineering_freeze_meaning": "No unreviewed structural/content changes while Core Method v2 is implemented. Not scientifically validated, not production ready."
    },
    {
      "path": "assets/data/assessment_v3/eq/eq_pilot_tr_v1_review_candidate_1.json",
      "module": "eq",
      "role": "eq_review_candidate",
      "form_id": "eq_tr_pilot_v1_review_candidate_1",
      "content_version": "eq-tr-pilot-v1-review-candidate-1",
      "parent_content_version": "eq-tr-pilot-v1",
      "schema_version": 3,
      "review_state": "red_team_reviewed",
      "calibration_status": "uncalibrated",
      "status": "internal_review",
      "sha256": "a84e6ce428d47069b1e09ad3d796bb5c44a5cbb43606001d3eddbcda7c1f22d3",
      "runtime_loaded": false,
      "production_wired": false,
      "question_text_freeze_status": "frozen",
      "option_text_freeze_status": "frozen",
      "evidence_delta_freeze_status": "frozen",
      "metadata_freeze_status": "frozen_with_acknowledged_pair_registry_mode_metadata",
      "known_pending_reviews": [
        "expert_psychological_review",
        "expert_language_review",
        "cognitive_interviews",
        "psychometric_calibration"
      ],
      "engineering_freeze_meaning": "No unreviewed structural/content changes while Core Method v2 is implemented. Not scientifically validated, not production ready."
    },
    {
      "path": "assets/data/assessment_v3/frequency/frequency_pilot_tr_v1.json",
      "module": "frequency",
      "role": "frequency_pilot_parent",
      "form_id": "frequency_tr_pilot_v1",
      "content_version": "frequency-tr-pilot-v1",
      "parent_content_version": null,
      "schema_version": 3,
      "review_state": "internal_review",
      "calibration_status": "uncalibrated",
      "status": "pilot",
      "sha256": "8b9e3b13f761707d32cee62dc4a3eef02e8983b1c76b71ae4976543457b041ab",
      "runtime_loaded": false,
      "production_wired": false,
      "question_text_freeze_status": "frozen",
      "option_text_freeze_status": "frozen",
      "evidence_delta_freeze_status": "frozen",
      "metadata_freeze_status": "frozen_with_acknowledged_pair_registry_mode_metadata",
      "known_pending_reviews": [
        "expert_psychological_review",
        "expert_language_review",
        "cognitive_interviews",
        "psychometric_calibration"
      ],
      "engineering_freeze_meaning": "No unreviewed structural/content changes while Core Method v2 is implemented. Not scientifically validated, not production ready."
    },
    {
      "path": "assets/data/assessment_v3/frequency/frequency_pilot_tr_v1_review_candidate_1.json",
      "module": "frequency",
      "role": "frequency_review_candidate",
      "form_id": "frequency_tr_pilot_v1_review_candidate_1",
      "content_version": "frequency-tr-pilot-v1-review-candidate-1",
      "parent_content_version": "frequency-tr-pilot-v1",
      "schema_version": 3,
      "review_state": "red_team_reviewed",
      "calibration_status": "uncalibrated",
      "status": "internal_review",
      "sha256": "06e35a1edf239600a5949de9c39ddc3374afda3f754bd30bd761eead88d7beb4",
      "runtime_loaded": false,
      "production_wired": false,
      "question_text_freeze_status": "frozen",
      "option_text_freeze_status": "frozen",
      "evidence_delta_freeze_status": "frozen",
      "metadata_freeze_status": "frozen_with_acknowledged_pair_registry_mode_metadata",
      "known_pending_reviews": [
        "expert_psychological_review",
        "expert_language_review",
        "cognitive_interviews",
        "psychometric_calibration"
      ],
      "engineering_freeze_meaning": "No unreviewed structural/content changes while Core Method v2 is implemented. Not scientifically validated, not production ready."
    },
    {
      "path": "assets/data/trait_scoring_config_v1.json",
      "module": null,
      "role": "trait_scoring_config",
      "form_id": null,
      "content_version": null,
      "parent_content_version": null,
      "schema_version": "trait_scoring_config_v1",
      "review_state": null,
      "calibration_status": null,
      "status": "provisional",
      "sha256": "1435da399e8be329b4f09f1d73dc6f90d81db8bb72fa4d01339bb332dab113a3",
      "runtime_loaded": false,
      "production_wired": false,
      "question_text_freeze_status": "n/a",
      "option_text_freeze_status": "n/a",
      "evidence_delta_freeze_status": "n/a",
      "metadata_freeze_status": "frozen",
      "known_pending_reviews": [
        "n/a"
      ],
      "engineering_freeze_meaning": "No unreviewed structural/content changes while Core Method v2 is implemented. Not scientifically validated, not production ready."
    },
    {
      "path": "docs/core_engine/canonical_dimension_registry_v1.md",
      "module": null,
      "role": "canonical_registry_doc",
      "form_id": null,
      "content_version": null,
      "parent_content_version": null,
      "schema_version": null,
      "review_state": null,
      "calibration_status": null,
      "status": null,
      "sha256": "8cbd1bd53fc3f7fd660b6c641ec9fa70944c8c2ae8aa817dadbde4ac063e47b6",
      "runtime_loaded": false,
      "production_wired": false,
      "question_text_freeze_status": "n/a",
      "option_text_freeze_status": "n/a",
      "evidence_delta_freeze_status": "n/a",
      "metadata_freeze_status": "frozen",
      "known_pending_reviews": [
        "n/a"
      ],
      "engineering_freeze_meaning": "No unreviewed structural/content changes while Core Method v2 is implemented. Not scientifically validated, not production ready."
    },
    {
      "path": "assets/data/core_method_v2/canonical_dimension_registry_v1.json",
      "module": null,
      "role": "canonical_registry_json",
      "form_id": null,
      "content_version": null,
      "parent_content_version": null,
      "schema_version": "canonical_dimension_registry_v1",